	STAGE	CLUSTER	MATCH N-1	ASSIGNED CELL TYPE/STATE	ENRICHED MARKERS
224	20 hpf	25	18h-50	telencephalon (pallium, neuron)	myt1a, insm1b, celf3a, dlx2b, elavl3, foxg1a, insm1a, myt1b, vsig8a, cldnh, eomesa, dlb, neurod4, emx3, tbr1b, srrm4
225	20 hpf	26	NA	eye (epidermis)	krt15, cxl34b.11, aqp3a, gstm.3, epgn, spaca4l, cldn1, rac2, capgb, postna, pycard, caspb, col17a1b, anxa2a, hcls1
226	20 hpf	27	18h-59	epidermal ionocyte	cldnh, foxi3a, foxi3b, cldnb, cldn7b, spint2, capn8, ap1s3b, oclna, elf3, f11r.1, epcam, pou2f3, tnks1bp1
227	20 hpf	28	18h-30	pectoral fin field	tnni1b, tmem88a, gdf3, angptl6, gata5, cd151, jam2b, hand2, gata6, pcolcea, cracr2b, tnnt2a, rhag, ttn.2, nkx2.5, rdh10a
228	20 hpf	29	18h-54	rostral blood island (myeloid)	lmo2, etv2, tmem88a, dusp5, clec14a, sox7, cldn5b, tal1, mrc1a, cdh5, fli1a, yrk, she, ecscr, gpr182, plk2b, myct1a, erg
229	20 hpf	30	18h-4/42	midbrain	eng2b, eng2a, eng1b, pax2a, pax8, eng1a, pax5, fgf8a, cnpy1, her11, oc90 zic5, ism1, fzd10, pax3a, sox21a, pax7a
230	20 hpf	31	18h-24/25	hindbrain rhombomere 5/6	mafba, cryba2b, lim2.1, cx23, egr2b, hoxa3a, hoxb3a, cyp26c1.1, rnd2, cryba4, irx1b, egr2b
231	20 hpf	32	18h-47/57	periderm	anxa1c, lye, agr1, anxa1b, ppl, tgm1l4, cldne, mid1ip1a, capn9, elovl7b, evpla, hsd17b12a, spint2, stard14, ovol1
232	20 hpf	33	NA	retina (neurogenesis)	rx1, vsx2, pax6b, nusap1, kpna2, cdk1, six3b, nr2e1
233	20 hpf	34	NA	cerebellum (upper rhombic lip)	insm1a, zic2a, neurod1, eng1b, zic5, atoh1c, nfia, tubb5, oprd1b, nfixb, zbtb4, b3gnt7l, s100b, tfr1b, clybl, nebl
234	20 hpf	35	18h-34	neurons, gabaergic	inab, gng3, elavl4, hmp19, fez1, rtn1b, cnrip1a, sncb, id4, tubb5, scg3,gad2
235	20 hpf	36	18h-39	epidermis	spaca4l, cfd, mmp30, col7a1, emilin2b, arhgef25b, apoc2, cyp2aa6, ecrg4b, tmem54a, tspan33a, myh9a, igfbp2a
236	20 hpf	37	18h-56	macrophages	ccl34.1, cd74a, cd74b, fcer1gl, lgals9l1, arpc1b, mfap4, coro1a, havrc1, mhc2dab, ms4a17a.10, mpeg1.1, lcp1, ctss2.2
237	20 hpf	38	18h-50	telencephalon (pallium, neuron) glutamatergic	nrgna, bhlhe22, bhlhe23, cpne2, pcsk1nl, ak5, syt12, adcyap1r1a, gria2b, eomesa, gabrb3, neurod6a, rtn4rl2a, neurod6b, slc17a6a
238	20 hpf	39	18h-43	neural crest derived (xanthophore)	akr1b1, slc22a7a, gpr142, tmem130, slc45a2, sox10, slc2a15b, tmem243a, cax1, bscl2l, aox5, mitfa, bace2, tfap2e
239	20 hpf	40	NA	eye (epidermis)	lgals1l1, cxl34b.11, aep1, rhbg, aqp3a, epgn, entpd3, col17a1a, hcls1, itgb1b.2, hhipl2, pcolce2b, eevs, plek2
240	20 hpf	41	18h-17	hindbrain (ant. dorsal, rhombic lip)	atoh1a, olig3, olig4, msx3, zic1, atoh8, casz1, zic2b, zic4, zic2a, irx1b, msx1b, fzd10
241	20 hpf	42	18h-29	lens differentiation	foxe3, vcana, hmx4, hmx1, pitx3, aplnra, six3b, prox1a, dlx3b
242	20 hpf	43	18h-18	telencephalon	emx3, hesx1, foxg1a, noto, znf296, lhx2b, sp8a, fezf2, nog1, sp8b, fezf1, nr2e1, mki67
243	20 hpf	44	NA	retina (photoreceptor precursor cells)	rcvrn2, arr3a, rs1a, ckmt2a, opn1mw1, gngt2b, opn1sw1, opn1lw2, gnb3b, pde6h, rbp4l, rho, syt5b, crx, pde6c
244	20 hpf	45	NA	neurons, glutamatergic	elavl4, chga, prph, vim, nefmb, tubb5, entpd3, uchl1, tubb2, neflb, calb2a, sst6, nefma, islr2, isl2a, phox2bb, ppp1r1c
245	20 hpf	46	NA	retina neuroblasts (amacrine/horizontal)	hes2.2, atoh7, hes2.1, hes6, fabp7a, neurod4, insm1a, ascl1a, mki67, vsx1, her15.2, foxg1b, her4.2, six6b
246	20 hpf	47	NA	cartilage	matn1, mia, epyc, col11a2, tnxba, fgfbp2b, ptgdsa, itih1, chad, acana, emilin3a, cthrc1b, col2a1a, col9a3, col9a1a, lect1
247	20 hpf	48	18h-53	RPE differentiation	dct, pmela, tfec, wnt2, slc45a2, pmelb, tyrp1a, trpm1b, rlbp1a, sytl2b, qdpra, oca2, fabp11a
248	20 hpf	49	NA	pigment cell (iridophore)	apoda.1, gpnmb, akap12a, scn4ab, nme4, emp3b, pnp4a, rab38b, defbl1, sox10
249	20 hpf	50	NA	retina (muller glia)	tkta, ca14, pax10, vil1, hyal6, cacng5a, rlbp1a, gpr37a, cpne8, cahz, foxg1b, slc24a3, ush1c, cxalb2bb, tagapb, fabp7a
250	20 hpf	51	NA	muscle	myog, myod1, stc2b, chrna1, chrnd, trim63a, cacng1a, stac3, cav3, abraa, tmx2a, txlnbb, vwde, myf5, rbfox1l, ttn.1
251	20 hpf	52	18h-49	neurons (ganglion)	neurod1, six1b, isl2b, onecut1, tlx2, dlb, efb3a, ntrk3a, eya2, nr6a1b, msi2a, cdh6, insm1b, neurod4, six4b
252	20 hpf	53	NA	glia	soul5, apof, CFI, cp, clec3ba, steap4, slc13a4, vmo1v, slc13a2, slc22a7b.1, igfbp2a, epd
253	20 hpf	54	18h-37	floor plate	shha, loxl5b, col9a1b, shhb, foxa1, foxj1a
254	20 hpf	55	18h-54	rostral blood island (myeloid)	srgn, sox7, tnfrsf9a, epas1b, rca2.2, clic2, slco1d1, clec14a, flt1, kdrl, cdh5, ca16b, abcc2, she, myct1a, pecam1
255	20 hpf	56	18h-45	otic vesicle	bricd5, otomp, atp1a1a.4, cldna, stm, otogl, sox10, agr2
256	20 hpf	57	NA	neurons (no neurod1/neurod4) glutamatergic	camk2a, add3b, iqsec2, ccdc136a, prkcbb, raver2, ppp1r1c, grm5a, lrmp, gabrd, ccka, camk4, pvalb7, slc17a6a
257	20 hpf	58	18h-47/57	periderm	sceI, rhcga, abcb5, elf3, ponzr3, sepw2b, epdl1, plekhf1, tmem45b, apodb, abca12, stx11b.1, xkr8.2, pkhd1l1
258	20 hpf	59	18h-52	heart primordium	cmlc1, myl7, vmhc, tnnt2a, tnni1b, acta1b, fhl2a, tnnc1a, ttn.2, lft2
259	20 hpf	60	NA	muscle (fin)	rasl12, ndufa4l2a, myh11a, mylka, kcne4, pgfb, rbpms2b, angptl3, bgnb, mfap5, parvab, acta2, tagln, ednraa
260	20 hpf	61	NA	oligodendrocytes	cd226, cldnk, crp1, csrp1b, cx27.5, cx47.1, fabp2, flj13639, lim2.2, ly75, ninj2, pla1a, rsad2, ugt8
261	20 hpf	62	NA	neuromast (otic)	atp1b2b, anxa5a, otofb, cabp2b, s100a1, calml4a, gipc3, tmc2a, c5h11orf1, lhfpl5a, pvalb8, pvalb9, gpx1b
262	20 hpf	63	NA	purkinje neurons	pvalb7, nrgnb, aldoca, pcp4l1, pbxip1b, olfm1b, ca8, rtn1a, atp2b1a, itpr1b, skor1b
263	20 hpf	64	NA	RPE	rlbp1b, rpe65a, mb, dct, rgra, rdh5, fabp11b, rbp4l, mb, pmela, pmelb
264	20 hpf	65	NA	lens	crybb1, cryba4, crygn2, crygmx, cryba1l1, mipb, lim2.4, lim2.1, crygm2d10, hmx4, prox2
265	20 hpf	66	18h-55	prechordal plate/polster	ctslb, he1a, he1b, ctslb.1, mctp2b, mgp, tmprss9, slc30a8, lad1, vtcn1, sytl4, b3gnt5b, svopl, mal
266	20 hpf	67	NA	dermal bone	col10a1a, ifitm5, spp1, entpd5a, bgna, bmp8a, col5a2b, loxl4, prp
267	20 hpf	68	NA	dorsal habenula, glutamatergic	gng8, synpr, syt6b, cpne4b, NWD2, syt10, kctd12.1, slc17a6b
268	20 hpf	69	NA	cornea	fgl2a, tubb6, gyg1b, tkta, ccka, pitx1, hpdb, hgd, pitx3, pitx2, scinla
269	24 hpf	0	20h-6/30	progenitors (midbrain, optic tectum?)	pax7a, eng2b, mab21l2, dmbx1a, pax7b, otx2, mab21l1, cep112, foxn4, pax3a
270	24 hpf	1	20h-4	progenitors	dbx1a, dbx1b, her3, cyp26b1, gbx1, gfap, foxb1a, sox21a
271	24 hpf	2	20h-11	committed progenitors	gadd45gb.1, neurog1, dla, dld, neurod4, dlb, ebf2, rnf165a, srrm4, elavl3
272	24 hpf	3	NA	progenitors	NA (stmn1a, fabp7a)
273	24 hpf	4	20h-41	hindbrain (ant. dorsal, rhombic lip)	atoh1a, olig3, atoh8, olig4, msx3, meis2b, cdh6, zic2b
274	24 hpf	5	NA	dorsal dienchephalon (thalamus)	barhl2, tcf7l2, helt, dbx1a, otx1a, otx2, foxb1a, olig3, otx1b, fgfr3
275	24 hpf	6	20h-33	retina (neurogenesis)	rx1, six3b, vsx2, wfdc1, pax6b, six6b, fabp7a, crip3, tbx2b
276	24 hpf	7	20h-13	pharyngeal arch (posterior)	hoxa3a, hoxc3a, hoxb8a, hoxb5b, hoxb6a, hoxb3a, hoxb5a, hoxb7a, hoxc3a, hoxd4a, wnt11r, gfap, sp8a
277	24 hpf	8	NA	progenitors	her8a, sox3, lrrn1, gfap, her4.2, her12, mcm3, mcm4, pcna
278	24 hpf	9	20h-8/23	neurons, gabaergic (telencephalon)	elavl4, sncb, gng3, hmp19, ywhag2, stmn2b, mllt11, snap25a, rtn1b, atp6v0cb, atpv0e2, fez1, stmn2a, gad2
279	24 hpf	10	20h-7	ventral diencephalon	nkx2.1, nkx2.4b, rx3, nkx2.4a, fezf2, prdx1, shha
280	24 hpf	11	20h-10	epidermis	tnw, aqp3a, kera, spaca4l, pfn1, cldni, thy1, col28a2a
281	24 hpf	12	20h-21	neurons	dlb, myt1b, scrt1a, scrt2, onecut1, nhlh2, elavl3, ebf2, mllt11, mpp2a, efb3a, golga7ba, srrm4, draxin
282	24 hpf	13	NA	telencephalon, optic stalk (ventral diencephalon)	fezf1, vax1, sox1b, foxg1a, fezf2, cyp26c1.1, gsx2
283	24 hpf	14	NA	hinbrain rhombomere 7	hoxa3a, hoxb3a, hoxc3a, hoxd4a, olig3, gsx2, cygb1, casz1, olig4, pax3a
284	24 hpf	15	20h-14	neural crest (pharyngeal arch)	twist1a, dlx2a, ednrab, grem2b, prrx1b, fli1a, tuba8l3, twist3, barx1, snai1a, prrx1a, npb, foxc1b
285	24 hpf	16	20h-30	midbrain	eng2b, eng2a, eng1b, pax8, pax2a, eng1a, fgf8a, her12
286	24 hpf	17	20h-10	epidermis	krt96, krt97, ptgs2a, spaca4l, kera, gstm.3, tp63, cldni, thy1, dlx3b, pitx2
287	24 hpf	18	NA	epidermis	six1b, vgll4l, tfap2a, dcn, sfrp2, kera, foxi1, she, pfn1, cfl1l, krt8
288	24 hpf	19	NA	hindbrain	casz1, msx3, zic1, zic2a, irx1b, zic4, egr2b, olig3, fzd10
289	24 hpf	20	NA	pharyngeal endoderm	pax1b, foxa2, fgfrl1b, irx7, nkx2.7, hoxb1b, nkx2.3, s100t, ociad2, cldnb, cd9b
290	24 hpf	21	20h-16	ventral midbrain	tm6sf2, nkx2.2b, nkx2.9, phox2bb, nkx2.2a, sulf2b, nkx6.1, phox2a, nkx6.2, foxa
291	24 hpf	22	20h-33	retina (neurogenesis, dorsal)	fabp7a, hes2.2, ascl1a, six3b, pax6b, pax6a, neurod4, rx1, six6b, tbx2b, vsx1, hmx4, vsx2, foxg1b, nr2e1
292	24 hpf	23	20h-0	optic vesicle (ventral)	rx1, cx43, pax6b, fabp11a, six3b, rx2, wfdc1, vsx2, cyp27c1, col15a1b, foxd1
293	24 hpf	24	NA	hindbrain rhombomere 2/3	lbx1b, gsx1, pax3a, cyp26b1, phox2bb, rnd2, pax7a, sox21a, gas1b, auts2b, egr2b
294	24 hpf	25	20h-17	placode (epibranchial)	cyp26a1, foxi1, nkx2.7, nkx2.3, tlx1, tmef2a, tagln2, s100a10, cldni
295	24 hpf	26	20h-32/58	periderm	agr1, lye, cldne, ppl, capn9, anxa1b, tgm1l4, fut9d
296	24 hpf	27	NA	diencephalon (ZLI)	shha, foxa2, foxa1, barhl1a, foxa, ntn1b, ldlrad2, lmx1ba, lmx1bb, spon1b, barhl2, pitx3
297	24 hpf	28	20h-10	epidermis	lgals1l1, dlx4a, krt222, dhrs9, col7a1, ptgdsb.1, ptgdsb.2, msx2a
298	24 hpf	29	20h-19	mesoderm	fmoda, cthrc1a, cldn11a, csf1a, alx4a, foxc1a, colec12, twist1a
299	24 hpf	30	20h-12	eye (cornea), cartilage	cthrc1a, col9a3, col9a2, lect1, col9a1a, pcolcea
300	24 hpf	31	NA	pectoral fin	and1, and2, emilin2b, ecrg4a, vcana, ogn, bhlha9
301	24 hpf	32	20h-28	pectoral fin field	rhag, gata5, tmem98, jam2b, rbpms2b, colec11, tmem88a, hand2, gdf3, gata6
302	24 hpf	33	NA	placode (adenohypophyseal)	pvalb8, cldnh, sp8a, mal, six1b, cldnb, elf3, hey1, fezf1, 
303	24 hpf	34	20h-1/43	telencephalon, glutamatergic	nfia, foxg1a, emx3, eomesa, nog1, lmo1, slc1a2b, fezf2, fezf1, sox19b, znf296, emx2
304	24 hpf	35	20h-10	epidermis (progenitors)	lgals1l1, qpct, lamb4, ptgdsb.2, col7a1, ptgdsb.1, ccdc3b, igfbp2a, abi3bpb, lrata
305	24 hpf	36	20h-19	mesoderm	vwde, meox1, rbp7b, tcf15, nkx3-1, thbs4b, efemp2b, efemp2a, twist1a
306	24 hpf	37	20h-52	neurons (ganglion)	neurod1, isl2b, pvalb6, pcbp4, cdh6, tlx2, entpd1, tuba8l3, six1b, ebf3a, neurod4, msi2a, onecut1, kctd12.2
307	24 hpf	38	20h-15	neural crest (ectomesenchyme)	foxc1a, fibina, pitx3, tmem88b, foxf2a, cxcl18b, tbx1.1, six2a, pmp22a, shisa3, apln, prrx1a
308	24 hpf	39	20h-36	epidermis	rbp4, cfd, mmp30, fn1b, igfbp2a, apoeb, mvp, lum
309	24 hpf	40	20h-29	rostral blood island (myeloid)	yrk, vsg1, stab2, aqp1a.1, clec14a, cldn5b, cdh5, sox7, f13a1b, etv2, fli1a, yrk, gpr182, lmo2, etv2, mrc1a
310	24 hpf	41	20h-0	optic vesicle (ventral)	rx1, tbx2a, pax6b, wfdc1, vsx2, six3b, foxd1
311	24 hpf	42	NA	epidermis	shhb, sost, pitx2, isl2a, fgfrl1b, cxcl12b, krt18, tnc, nkx3.3, nkx2.3, nkx2.7, foxe3
312	24 hpf	43	NA	olfactory bulb (neurons, glutamatergic)	pvalb5, cldnh, vsig8a, atp2b1b, capslb, abhd2b, fstl5, lhx2a, capsla, chga, insm1a, gng13b, neurod4, efb3a, foxg1a
313	24 hpf	44	NA	diencephalon (no shh) (prethalamic progenitors)	olig2, gsx2, lhx5, foxd1, nkx2.2a, nkx2.9, ascl1a, dlx2a, nkx2.2b, cdh11, otx1a
314	24 hpf	45	20h-66	prechordal plate/polster	he1a, he1b, ctslb, ctslb.1
315	24 hpf	46	20h-39	neural crest	sox10, foxd3, ednrab, mcamb, crestin, fxyd1, mmp17b, reck, prdm12b, qdpra, nr2f5, tfap2a, cdh6
316	24 hpf	47	20h-51	muscle	atp2a1, tnni2b.1, tnnt2c, ckmb, smyhc1, aldoab, tnnc2, ttn.2, acta1a, acta1b, tnnt3a, srl, ttn.1, tnni1al, myod1, myog
317	24 hpf	48	20h-56	otic vesicle	stm, otomp, cldna, bricd5, sox10, atp1a1a.4, cahz, oc90, mb, tecta, col9a1b
318	24 hpf	49	20h-54	floor plate	loxl5b, clu, shhb, cd59, enkur, daw1, cd59, foxj1a, lcn15
319	24 hpf	50	20h-39	neural crest derived (pigment/xanthophore)	akr1b1, tmem130, slc22a7a, cx30.3, rbp4l, aox5, urah, pnp4a, slc2a15b, tmem243a, gpr143, cax1, pah, gch2, prdx1
320	24 hpf	51	20h-48/64	RPE	dct, pmela, tyrp1b, slc45a2, pmelb, rlbp1a, tyrp1a, wnt2, tfec
321	24 hpf	52	20h-27	epidermal ionocyte	atp1b1b, atp1a1a.2, ca15a, agrp, foxi3b, mal2, foxi3a, sgk2a, dmrt2a, ceacam1, sstr5, gcm2
322	24 hpf	53	20h-42	lens differentiation	cx23, cps1, foxe3, lgals2b, lim2.1, crybb1, prox2, hmx4, pitx3, cryba2a
323	24 hpf	54	NA	pigment cell (neural crest derived)	tyrp1b, dct, slc45a2, pnp4a, tyrp1a, tmem243a, pah, mitfa, tfap2e, oca2, agtrap, crestin, sox10
324	24 hpf	55	NA	notochord	cmn, col11a2, ta, loxl5b, tdgf1, col8a1a, mxr8a, hdr, gas2b, matn3b, adra2a, chadla, susd5
325	24 hpf	56	20h-59	heart primordium	myl7, cmlc1, tnnt2a, vmhc, fhl2a, tnni1b, tnnc1a, lft2, nppa, actc1a
326	24 hpf	57	NA	neutrophils	lyz, mfap4, ccl34a.4, srgn, coro1a, fcer1gl, npsn, lgals2a, arpc1b, prdx5, ltah4
327	24 hpf	58	NA	erythrocytes	hbbe3, hbae3, hbbe1.2, hbbe2, cahz, slc4a1a, blvrb
328	36 hpf	0	NA	pharyngeal arch (cartilage)	hand2, barx1, foxf2a, prrx1b, gsc, satb2, twist1b, lhx6, pmp22a, hoxa2b, dlx2a, dlx5a, dlx6a, prrx1a
329	36 hpf	1	NA	pharyneal arch	prrx1a, pmp22a, prrx1b, postnb, ccl25b, cxcl12a, lrrc17, cdh11, ms4a17a.9,loxl2b, cd248a
330	36 hpf	2	NA	pharangeal arch	dlx4a, dlx3b, dlx5a, nkx3.2, dlx4b, dlx2a, dlx6a, spon2b, fgfbp2a, bmpr1ba, foxc1b, rgmd, twist1a
331	36 hpf	3	NA	cartilage	col2a1a, matn4, lect1, col9a3, cthrc1a, col9a1a, col9a2, tgfbi, fibina, col11a2, wfdc2, pcolcea, gpx7
332	36 hpf	4	NA	progenitors	gfap, plp1a, neurog1, sox3, lipg, her8a, her12, foxb1a, ntn1a, metrn, sp8a, gbx1
333	36 hpf	5	NA	neurons (d. diencephalon, thalamus)	stmn1b, tubb5, tuba1c, dpf1, fez1, elavl4, lhx9, lhx2b, elavl3
334	36 hpf	6	NA	progenitors	NA (pcna, stmn1a)
335	36 hpf	7	NA	neurons	nell2b, rbfox1, snap25a, sncb, elavl4, onecut1, raly, olfm2a, tubb5, 
336	36 hpf	8	24h-29	mesoderm	fmoda, tnw, bhmt, cthrc1a, tfpia, col1a1a, pdgfrl, col1a2, fibina, col5a1, ca6, colec12
337	36 hpf	9	NA	retina neurogenesis	ascl1a, hes2.2, six6b, rx1, six3b, nr2e1, acbd7, fabp7a, vsx2, foxg1b, six3a, crabp2a, tjp2b, vsx1, foxn4
338	36 hpf	10	NA	midbrain (optic tectum)	tal1, zfpm2b, gata3, gata2a, sox14, lhx1a, emx2, pax7a, uncx, otx1b, uncx4.1, lhx5, elavl3, tfap2e, slc32a1
339	36 hpf	11	24h-9	neurons, gabaergic	scg2b, kctd4, egr4, syt9a, islr2, cnih2, atpv0e2, cpne2, sncb, cspg5a, lin7a, elavl4, elavl3, gad2
340	36 hpf	12	24h-19/24	hindbrain	prss35, lbx1b, plp1a, gsx2, zic1, atp1b4, zic4, gfap, gsx1, msx3, pax3a, fabp7a, slc1a3a, zic3, her8a, sox19a, hoxd4a
341	36 hpf	13	NA	progenitors (midbrain)	ascl1b.1, helt, hs3st1l2, sox19a, her2, otx1a, her4.1, pax7a, cep112, gsx1, dla, pax7b, dbx1a, pax3a, otx2, eng2b
342	36 hpf	14	NA	retina neuroblasts (amacrine/horizontal)	atoh7, hes2.2, ndrg1b, otx2, olig2, neurod4, foxn4, vsx1, sept4a, foxg1b, insm1a, tfap2d, neurod1, hes2.1
343	36 hpf	15	NA	neurons (midbrain)	dmbx1a, skor1b, tfap2b.1, pax8, tfap2a, crabp1b, pax2a, lhx1a, elavl3, uncx3.1, scrt1a, gdf11, gbx1, lhx5
344	36 hpf	16	24h-15	neural crest (pharyngeal arch)	grem2b, dlx2a, barx1, emx2, twist1a, lhx6, pmp22a, dlx5a, dlx4a, fmoda, krt18, rgmd, her6, ms4a17a.7, six1a
345	36 hpf	17	24h-12	comittted progenitors	her4.2, dlb, her15.1, her15.2, gadd45gb.1, elavl3, ebf2, scrt2, insm1a, myt1b, ebf3a, srrm4, dla, tfap2e, neurod1, neurod4, eng2b
346	36 hpf	18	NA	diencephalon (tuberculum; gabaergic)	otpb, otpa, scrt1a, lhx1a, scrt2, myt1b, lhx5, pax2a, uncx, elavl3, tubb5, nhlh2, eng1b, phyhiplb, olig4, gdf11
347	36 hpf	19	24h-9	neurons, gabaergic/glutamatergic	aldocb, snap25a, scg2b, ndufa4, tubb2, stmn4, syn2a, slc2a3a, cdk5r2a, pygmb, vgf, glrbb, clstn3, syt12
348	36 hpf	20	24h-10	ventral diencephalon	nkx2.4a, nkx2.4b, slc1a3b, rx3, nkx2.1, fezf2, sox1b, prdx1, sox19a, atp1b4, her4.1, 
349	36 hpf	21	NA	retina (amacrine)	pax10, pax6b, prdm13, pax6a, bhlhe22, tfap2c, s1pr1, six6b, fabp7a, tfap2a, pde6g, barhl2, foxg1b, six3a
350	36 hpf	22	24h-5/NA	dorsal diencephalon (thalamus)	lef1, barhl1a, pou4f1, barhl2, lhx9, pou4f2, lhx2b, nrn1a, tfap2d, fez1, elavl3, thsd7aa, pak1
351	36 hpf	23	NA	retina (photoreceptor precursor cells)	pde6g, crx, otx5, gngt2a, nr2e3, tmx3, six7, samd7, rcvrn2, rxrgb, prdm1a, thrb, neurod1, aplnrb, foxg1b
352	36 hpf	24	NA	progenitors (mid/hind)	sox19a, pdgfaa, zic3, atp1b4, zic4, zic2a, fabp11a, pax7b, zic1, tnfrsf19, cnpy1
353	36 hpf	25	NA	hindbrain	phox2bb, phox2a, prph, slc18a3a, tm6sf2, nefmb, nkx6.1, slit3, isl2a, isl1, lhx4, hoxb6b, onecut1, hoxb5b
354	36 hpf	26	24h-2	committed progenitors	neurog1, cep131, her13, dla, dld, gadd45gb.1, her4.1, fstl1a, neurod4, her4.2, dbx1a, her12, ascl1b.1, elavl3
355	36 hpf	27	NA	retina (RGC)	rbpms2b, cxcr4b, isl1, pax6b, isl2b, pax6a, pou4f2, barhl1a, scrt2, roraa, rbpms2a, pou6f2, six3b, hmx4
356	36 hpf	28	NA	neurons (differentiating, optic stalk?)	gata2a, prdm8, foxn4, golga7ba, slc29a2, dlb, rbpjb, enc3, vsx1, sox14, her15.2, elavl3, myt1b, tal1, dla
357	36 hpf	29	NA	pectoral fin (chondroblast)	hoxa9b, hoxd12a, hoxd9a, hoxa13b, hoxa11b, tbx5a, hoxd11a, hoxa10b, hoxd10a, myoc, hand2, ntd5
358	36 hpf	30	NA	muscle (mesoderm)	myf5, stc2b, hlx1, tcf21, vwde, myod1, tbx1.1, gfra3, igfbp5b, aplnrb, eya1, fgfrl1a, 
359	36 hpf	31	NA	hypothalamus/telencephalon, gabaergic	dlx2b, dlx1a, dlx5a, dlx2a, dlx6a, foxg1a, cxxc4, gad2, slc32a1, isl1, elavl3, tubb5, gas7a, celf4
360	36 hpf	32	NA	retina neuroblasts (amacrine/horizontal)	atoh7, ndrg1b, neurod4, fabp7a, crx, her15.2, insm1a, fkbp1ab, gadd45ba, neurod1, hes2.2
361	36 hpf	33	24h-4	hindbrain (ant. dorsal, rhombic lip)	atoh1a, olig3, atoh1b, olig4, msx1b, cep131, msx3, scrt1b, masp1, dla, her4.2, pou3f1, dld, zic1, her2, atoh8
362	36 hpf	34	24h-7	pharyngeal arch (posterior)	rdh10a, aldh1a2, meis3, hoxb5a, prdm1a, gsc, hoxb6a, hoxb8a, foxf2a, hoxb5b, prrx1b, apela, lhx6, snai1a
363	36 hpf	35	24h-37	neurons (ganglion)	neurod1, tlx2, isl2b, nr6a1b, kctd12.2, six1b, hey1, msi2a, isl2a, phox2a, six2b, fzd8a, tmeff2b, aldh1a2, insm1b
364	36 hpf	36	NA	neurons (ganglion)	chga, isl2b, pou4f1, eya4, sst6, tmeff2b, ppp1r1c, six2b, mgat4b
365	36 hpf	37	24h-24/NA	committed progenitors	lbx1b, her4.1, her12, dla, gadd45gb.1, lrrn1, dld, her2, her15.2, ascl1a, olig3, gsx2, slc1a3a, pax3a, elavl3
366	36 hpf	38	NA	hindbrain	lmx1bb, tlx2, phox2a, phox2bb, lmx1ba, tfap2a, kctd15a, uncx4.1, uncx, pou2f2a
367	36 hpf	39	24h-34	telencephalon (pallium), glutamatergic	neurod6b, eomesa, emx3, tbr1b, cpne2, r3hdm1, kcnip1b, foxg1a, sox4a.1, celf2, bcl11ba, olfm1b, gpr85
368	36 hpf	40	NA	retina neuroblasts (amacrine/horizontal)	vsx1, olig2, hes2.2, otx2, six6b, ascl1a, sept4a, foxg1b, neurod4, crabp1a, cldn5b, six3b, sox3, prox1a
369	36 hpf	41	24h-50	neural crest derived (pigment/xanthophore)	urah, rbp4l, slc22a7a, akr1b1, tmem130, gpd1b, bbscl2l, pon1, oacyl
370	36 hpf	42	NA	hindbrain/cranial nerve	hoxb6b, hoxb8a, hoxb6a, hoxb9a, hoxc3a, hoxb7a, hoxb5b, hoxc8a, hoxa3a, hoxb5a, elavl3
371	36 hpf	43	NA	epidermis	cldni, epcam, ptgs2a, krt92, tagln2, cd9b, lgals3b, egfl6.1, rac2, tp63, ecrg4b, cldn1, oclna
372	36 hpf	44	24h-47	muscle	myog, hsp90aa1.1, acta1a, myod1, tnni2b.1, rbm24a, actc1a, desma, jam2a, tmem38a, ttn.2, tat, ttn.1
373	36 hpf	45	24h-33	placode (adenohypophyseal)	cldnb, f11r.1, cldn7b, epcam, cd9bb, vgll4l, capn8, cldna, she, spint2, 
374	36 hpf	46	NA	pectoral fin	vwde, meox1, angptl7, thbs4b, pdgfrl, col1a1b, col1a2, col1a1a, pmp22a
375	36 hpf	47	NA	retina neurogenesis	ggctb, wfdc1, rx2, cx43, rx1, cyp27c1, aldh1a3, fabp11a, myca, chchd10, zic2b, vsx2, tktb, crip3, dkc1
376	36 hpf	48	NA	progenitors (hindbrain/cranial nerve)	hoxb8a, gfap, hoxc3a, hoxc1a, hoxb6b, hoxb6a, slc1a3a, dhrs3b, hoxb7a, hoxa3a, slc6a9, sp8a, her12
377	36 hpf	49	24h-58	erythrocytes	hbbe1.2, hbbe2, cahz, scl4a1a, tspo, blvrb, alas2, nt5c2l1, hbz, hmbsb
378	36 hpf	50	24h-21	ventral midbrain	ntn1b, shha, ptn, spon1b, ntn1a, daw1, sparcl1, nkx2.2b, nkx2.9, foxa, shhb, foxa1, foxa2, wnt7aa
379	36 hpf	51	24h-5/NA	dorsal diencephalon (thalamus)	scrt1b, alcama, barhl2, barhl1a, nrn1a, scrt1a, lhx2b, lhx9, hoxb3a, gdf11, dlb, plxna4 
380	36 hpf	52	24h-35	epidermis (progenitors)	cldni, lgals1l1, aep1, ptgdsb.1, thy1, rbp4, aqp3a, col1a1b, col11a1a, spaca4l, kera, ecrg4b, tagln2
381	36 hpf	53	NA	pigment cell (iridophore)	sox10, mcamb, emp3b, fxyd1, hepacama, phlda2, col4a1, apoda.1, vamp5, ndrg1a, slc35c2, atf3
382	36 hpf	54	24h-16	midbrain	eng1a, eng2a, pax5, eng1b, cnpy1, eng2bb, pax2a, slf1, pax2b, pax8, atohqa, irx1a, pou3f1
383	36 hpf	55	NA	RPE	tyrp1b, dct, pmela, rlbp1b, slc45a2, pmelb, tyrp1a, gpr143, rlbp1a, tmem243a, rab32a, oca2, pah, mitfa
384	36 hpf	56	24h-5/NA	dorsal diencephalon (thalamus)	tfap2e, tfap2b.1, pou4f1, kctd15a, tfap2a, barhl2, lhx9, lef1, tfap2d, islr2, shox2, foxb1a, scrt1b, eng2b, tcf7l2
385	36 hpf	57	NA	neurons, gabaergic	gata3, nkx1.2lb, tal1, gad1b, khdrbs2, gata2a, onecut1, snpa25a, elavl4, slc6a1b, slc32a1, vgf, rbfox1
386	36 hpf	58	NA	retina (photoreceptor precursor cells)	otx5, nr2e3, six7, crx, samd7, gngt2a, thrb, pde6g, vsx1, crabp1a, ndrg1b, rcvrn2, rxrgb, olig2, sept4a
387	36 hpf	59	24h-53	lens	mipa, cx23, otc, tubb6, crybbb1l3, crybba1l2, bfsp2, endou2, mipb, grifin, cryba1a, lim2.3, prox2, lim2.4, crygmx
388	36 hpf	60	24h-43	olfactory bulb (neurons, glutamatergic)	pvalb5, cldnh, pvalb8, capsla, vsig8a, lhx2a, fabp10b, bik, s100z
389	36 hpf	61	24h-57	neutrophils	mfap4, lgals2a, ccl34b.1, fcer1gl, coro1a, lygl1, srgn, havcr1, ccl34a.4, lgals3bpb, tnfb, gng10, mpeg1.1, crip1
390	36 hpf	62	24h-40	rostral blood island (myeloid)	etv2, vsg1, clec14a, cdh5, myct1a, bcl6b, ecscr, flt1, erg, fli1b, esama, scarf1, flt4, pecam1
391	36 hpf	63	NA	glial progenitors	fabp7b, hepacama, bmp2a, dnaaf1, ppfibp2a, tpbga, enkur, foxj1a, rspo2, wnt3a, rspo3, tex9, lmx1a
392	36 hpf	64	24h-26	eye (non retina)	anxa1b, cldne, capn9, anxa3a, elovl7a, tmem45b, dbnla, krt1-19d, elovl7b
393	2 dpf	0	36h-19	neurons, gabaergic	aldocb, sncb, ywhag2, snap25a, scg2b, eno1a, atp6v0cb, atpv0e2, gad2, gad1b
394	2 dpf	1	NA	cycling cells	npm1a, pcna, stmn1a, nop10
395	2 dpf	2	36h-0	pharyngeal arch (cartilage)	barx1, hand2, lhx6, dlx2a, prrx1b, twist1b, gsc, foxf2a, pax9, lhx8a, pmp22a, foxl1, hoxa2b, dlx5a
396	2 dpf	3	36h-2	pharangeal arch	dlx4a, nkx3.2, dlx5a, dlx3b, dlx4b, dlx2a, dlx6a, fgfbp2a, spon2b, barx1, fgfbp2b, bmpr1ba, foxc1b, foxc1a
397	2 dpf	4	NA	pharangeal arch/pectoral fin (mesoderm)	ccl25b, cthrc1a, aspn, lum, col6a1, col1a2, col1a1a, htra1a, vwa1, col12a1a, col6a2
398	2 dpf	5	NA	neurons (not gabaergic)	sncb, rtn1b, stmn2a, stmn2b, stmn1b, islr2, dclk1b, elavl4, cspg5a, gabrb4
399	2 dpf	6	36h-16	pharyngeal arch	dlx4a, grem2b, dlx5a, dlx2a, emx2, dlx4b, dlx3b, cad1b, nr2f1b, spon2b, dlx6a, fmoda, pmp22a, twist2, twist3, hoxa2b
400	2 dpf	7	36h-4	progenitors	neurog1, gfap, ascl1b.1, plp1a, her12, her4.1, her4.2, dld, dbx1a
401	2 dpf	8	NA	retina (photoreceptor precursor cells)	rs1a, gngt2a, crx, rcvrn2, elovl4b, otx5, ckmt2a, syt5b, neurod1, opn6a
402	2 dpf	9	NA	neurons	tubb5, elavl3, pax2a, lhx5, uncx, lhx1a, fez1, scrt1a, elavl4, 
403	2 dpf	10	36h-13	progenitors (midbrain)	ascl1b.1, her2, pax7a, sox19a, her4.1, plp1a. dbx1b, hs3st1l2, dbx1a, gsx1, eng2b, zic3, pax3a, otx1a, pax7b
404	2 dpf	11	36h-23/58	retina (photoreceptor precursor cells)	pde6g, otx5, crx, gngt2a, rxrga, nr2e3, samd7, six7, prdm1a, elovl4b, slc29a2, krcp
405	2 dpf	12	NA	radial glia	slc1a2b, atp1b4, atp1a1b, slc1a3b, ptn, ntn1b, qki2, hepacama, her8.2, abi3a, sulf2a
406	2 dpf	13	36h-17	progenitors/neurons (differentiating)	dlb, her4.2, her15.2, elavl3, ebf2, dla, srrm4, scrt2, her4.1, scrt1a, neurod4, celf3a, nova2
407	2 dpf	14	36h-9	retina neuroblasts (amacrine/horizontal)	hes2.2, atoh7, ascl1a, six6b, cldn5b, foxn4, hes2.1, six3b, six3a, rx1, dlc, dld, foxg1b, pax6b
408	2 dpf	15	NA	pharyngeal arch	ccl25b, prrx1b, hmx4, pmp22a, prrx1a, ctsk, twist3, bhmt, col1a2, hox2ab, gsc, pcolcea, eya1, boc
409	2 dpf	16	36h-21	retina (amacrine)	pax10, pax6b, pax6a, bhlhe22, tfap2a, tfap2b.1, tfap2c, barhl2, gpm6aa, s1pr1, meis2b, foxg1b, six6b
410	2 dpf	17	NA	retina neurogenesis	dlb, her4.2, her15.2, elavl3, ebf2, dla, srrm4, scrt2, her4.1, rx1
411	2 dpf	18	36h-33	hindbrain (ant. dorsal, rhombic lip)	olig3, atoh1a, her12, masp1, her4.1, olig4, her2, pax3a, zic1, gsx2, gfap, msx3
412	2 dpf	19	NA	eye (cornea), cartilage	lect1, col2a1a, col9a2, col9a3, col9a1a, aspn, pcolcea, cthrc1a, angptl5, tgfbi, ccl25b, ca6
413	2 dpf	20	36h-30	muscle (mesoderm)	vwde, jam2a, myod1, myf5, ttn.2, stc2b, hlx1, tcf21, lmod1a, tbx1.1, rbm24a, gfra3, jam2b, myog
414	2 dpf	21	36h-14/40	retina neuroblasts (amacrine/horizontal)	vsx1, olig2, hes2.2, otx2, ndrg1b, sept4a, neurod4, ptprua, crabp1a, neurog1, foxn4, foxg1b
415	2 dpf	22	36h-52	epidermis (progenitors)	krt91, krtt1c19e, lgals1l1, krt5, s100a10b, rbp4, cldni, aep1, col1a2, ptgdsb.1, cfl1l, col1a1a, thy1, ptgdsb.1
416	2 dpf	23	36h-43	epidermis	cfl1l, cldni, epcam, krt92, tagln2, ociad2, aqp3a, cldn1, lgals3b, ptgs2a, gstm.3, cd9b, tp63
417	2 dpf	24	36h-1	pharyneal arch (cycling)	pmp22a, mfap2, prrx1a, twist1a, cxcl12b, six1a, fli1a, 
418	2 dpf	25	NA	pharyngeal arch (neural crest?)	fgfbp2b, col9a2, matn4, col2a1a, col9a3, col9a1a, lect1, sox10, foxc1b, barx1
419	2 dpf	26	36h-32/NA	retina neuroblasts (amacrine/horizontal)	atoh7, hes2.2, insm1a, neurod4, otx2, foxn4, tfap2d, foxg1b, mki67
420	2 dpf	27	36h-31	hypothalamus 	dlx1a, nkx2.4a, dlx2a, dlx2b, dlx5a, gad2, dlx6a, zc4h2, fez1, prdx1, scl32a1, isl1
421	2 dpf	28	36h-3	cartilage	col2a1a, fgfbp2b, col9a3, col9a1a, col9a2, matn4, lect1, mia, tnxba, nog3, hapln1b, arsia
422	2 dpf	29	NA	glia (pharyngeal)	cldn11a, fabp11a, igfbp2a, cygb1, tfpia, pdgfrl, fstl1a, apof, tmem100b, zic2a, cx44.2, ca6
423	2 dpf	30	36h-63	glial progenitors	zic2a, clybl, zic4, zic1, zic5, zic6, zic3, fabp7b, hepacama, fzd10, zic2b, pdgfaa
424	2 dpf	31	NA	retina (cone bipolar cells)	gnb3a, vsx1, pcp4l1, samsn1a, crx, gng13b, ndrg1b, scg3, prox1a, scrt2, syt5b, bhlhe23, neurod4, otx5
