	STAGE	CLUSTER	MATCH N-1	ASSIGNED CELL TYPE/STATE	ENRICHED MARKERS
1	12 hpf	0	NA	optic vesicle	rx3, mab21l2, eif3ja
2	12 hpf	1	NA	optic vesicle	rx2, rx3, mab21l2, six3b, six7, lman1, pax6b, grasp, hmx4, six3a, swap70b, cxcr4a, tbx2b, lhx9
3	12 hpf	2	NA	midbrain	eng2a, her5, her11, eng2b, pax2a, ackr3a, pax7a, wnt8b, sox21a, fzd10, sp5a, her3
4	12 hpf	4	NA	neural crest	sox10, zic2b, tfap2a, sox9b, pax3a, twist1b, msx3, fam212aa (inka1a), ednrab, pdgfra, sox5, klf7a, cxxc5b
5	12 hpf	5	NA	mid-hind boundary/ant hindbrain	gbx2, ptgdsb.1, cyp26c1.1, ptgdsb.2, eng2b, pax2a, pou3f1, zic2a, her8a, eng2a, fgf8a
6	12 hpf	7	NA	midbrain neural rod	her3, sox21a, dmbx1a, sox19a, eng2b, wnt4a, pou3f3a, otx1b, ackr3a, otx2
7	12 hpf	8	NA	hindbrain rhombomere 7	wnt11r, hoxd4a, hoxa3a, crabp2a, hoxb1b, ptgdsb.1, her4.1, olig4, hoxc3a, hoxb5b, hoxa3b, rxrga
8	12 hpf	9	NA	diencephalon (posterior)	barhl1a, barhl2, olig3, rbfox3a, pax6a, wnt8b, wnt4a, emx2, fgfr3, lhx5, olig2, otx1b, foxb1a, thy1
9	12 hpf	10	NA	placode (lens)	arl3l1, ptgs2a, pitx3, vgll4l, p2rx3a, dlx3b, krt97, epcam, snai2, tagln2, fmo5, pax6b, foxe3, pax6b
10	12 hpf	11	NA	hindbrain rhombomere 5/6	mafba, egr2b, hoxa3a, hoxb3a, crygmx, cryba2b, crygn2, efemp2b, prox2
11	12 hpf	12	NA	dorsal diencephalon	lhx5, fezf2, olig2, pax6a, olig3, nr2e1, six7, nr2f2, emx3, foxd1
12	12 hpf	13	NA	telencephalon I (neurons)	emx3, foxg1a, ntn1b, sox1b, hesx1, rspo3, fezf2, ascl1b.1, npy, elavl3
13	12 hpf	14	NA	heart primordium	hand2, gata5, tdgf1, gdf3, gata6, foxh1, nkx2.5, tmem88a, tmem88b
14	12 hpf	15	NA	prechordal plate/polster	ctslb, he1a, ctslb.1, fkbp11, he1b, pitx2
15	12 hpf	16	NA	mesoderm	meox1, tmem119b, cthrc1a, prrx1a, thbs3b, nkx3-1, fsta, foxc1b, foxc1a, ripply1
16	12 hpf	17	NA	hindbrain rhombomere 1/2	VGLL3, hoxa2b, cyp26c1.1, irx3a, exd3, rgra, her4.2.1, ptgdsb.1, pax7b
17	12 hpf	18	NA	telencephalon II	zic4, fgf17, emx3, foxg1a, cdh6, fgf8a, zic1, dlx3b, dlx4b, rspo3, fezf2, zic2a, sp8b, zic5, 
18	12 hpf	19	NA	placode (trigeminal)	krt97, tp63, klf17, dlx3b, vgll4l, msx1b, ptgs2a, tfap2a, p2rx3a, dlx4b, irx1a, dlx4a
19	12 hpf	20	NA	ventral diencephalon	dbx1a, sst1.2. nkx2.4a, nkx2.4b, shha, shhb, nkx2.1, fzd8b, nkx2.2b, lft1, rx3
20	12 hpf	21	NA	placode (epibranchial)	foxi1, gbx2, pax8, arhgap27l, cldnb, f11r.1, eya4, eya2, sox3
21	12 hpf	22	NA	placode (otic)	cldna, PTCHD3, sp7, foxj1b, mcf2lb, stc2a, foxi1, myl10, pax2a, fgf24, pax8, gbx2
22	12 hpf	23	NA	ventral diencephalon (optic stalk)	nkx2.9, nkx2.2b, nkx2.2a, gsx2, olig2, foxd1, nkx2.1, nkx2.4b, vax1, ascl1a, lhx5
23	12 hpf	24	NA	hindbrain rhombomere 4	cyp26b1, prss35, kctd12.2, phox2bb, dusp2, egfl6.1, hoxb1a, cyp26c1.1
24	12 hpf	25	NA	mesoderm	ndnfl, six2a, pcolcea, foxc1a, plpp1a, twist1a, cxcl12b, nkx2.7, ripply1, aplnra
25	12 hpf	26	NA	mesoderm (pharyngeal arch, pectoral fin)	foxf2a, osr1, capgb, ebf3a, pknox2, tsku, foxc1a, twist1a, six1a, insb, ripply1, meox1, foxc1b, pitx3
26	12 hpf	27	NA	hindbrain rhombomere 3	egr2b, cyp26b1, epha4a, hoxb2a, her4.2, her3, hoxa2b, zwi, gabra5, gabrb3, myo1cb, pou3f1, pax7b, cspg5a, VGLL3
27	12 hpf	28	NA	epidermis	spaca4l, nme2a, dlx5a, cyp2aa6, dlx2a, ecrg4b, cyp2k16, rpe65b, mmp30
28	12 hpf	29	NA	placode (adenohypophyseal )	sp8a, fezf1, fgf24, dlx4b, arl3l1, six1b, cdr2l, dlx3b, fgf17, emx3, hesx1
29	12 hpf	30	NA	pharyngeal endoderm	pltp, mcama, gpm6ab, foxa2, foxa3, foxa1, foxa, prdx5, txn, nkx2.7
30	12 hpf	31	NA	sensory neurons (trigeminal)	elavl3, drgx, tuba8l3, neurod1, myt1a, dlb, scrt2, dla, ebf2, neurod4, srrm4, myt1b
31	12 hpf	32	NA	ventral midbrain	nkx6.2, helt, nkx2.9, phox2a, ntn1a, nkx2.2b, foxa, foxb1a, foxa2
32	12 hpf	33	NA	epidermis	hpgd, cldni, kera, fermt1, gata2a, ptk2bb, capn8, cldna, cldn1, gata3, tfap2c, nkx2.3, nkx3.2, hoxb5a, scinla, nkx2.7
33	12 hpf	34	NA	epidermis	cyp26a1, nkx2.3, nkx2.7, isl2a, rpe65b, dlx2a, spaca4l, foxi1, cldni, tagln2, gata2a, gata3, hand2
34	12 hpf	35	NA	adaxial cell	tnni2b.1, myod1, myf5, fn1b, ttn.2, ttn.1, myl10, actc1b, meox1, 
35	12 hpf	36	NA	rostral blood island (myeloid)	lmo2, tal1, etv2, spi1b, sox7, cebpa, fli1a, gata5, ripply2, gsc, gata6, fgf10a
36	12 hpf	37	NA	diencephalon	lhx4, noto, tdgf1, barhl2, lhx5, emx3, zic2a, pax6a, otx1a, rspo3
37	12 hpf	38	NA	neural crest 	dusp2, sox10, twist1b, sox9b, msx3, foxd3, hoxb2a, cxxc4, hoxb1a, tfap2a, hoxa2b
38	12 hpf	39	NA	floor plate	aplnr2, foxa2, shha, shhb, lgals2a, foxj1a, daw1
39	12 hpf	40	NA	mesoderm (head mesenchyme)	hgfa, foxf2a, foxc1b, insb, ntd5, twist1a, eya2, ripply1, rcn3, col11a1a, tsku, acp5a 
40	12 hpf	41	NA	neural crest (pre-mig/mig.)	guca2b, ednrab, sfrp2, crestin, sox10, sox9b, hoxa3a, foxd3, kalrnb, hoxb3a, tfap2a, crabp2a, msx3, egr2b, hoxc3a, hoxb1b
41	12 hpf	42	NA	periderm	capn9, cldne, ponzr5, ppl, icn2, mgst1.2, evpla, elovl7b, znf185
42	12 hpf	43	NA	placode (olfactory; neurons)	neurod1, neurod4, uncx, foxn4, lhx2a, unc4x.1, srrm4, insm1b, hes2.2, dlb, fgf24, fezf1, dlx4b, elavl3
43	12 hpf	44	NA	notochord	pmp22b, ta, loxl5b, emilin3a, hfe2, twist2, nog2, ntd5
44	12 hpf	45	NA	epidermal ionocyte	foxi3a, foxi3b, gcm2, atp1a1a.4, sstr5, foxg1b, ugt8, myb
45	14 hpf	0	12h-0	optic vesicle	rx1, rx3, mab21l2, foxd1
46	14 hpf	1	12h-1	optic vesicle (dorsal)	rx1, pax6b, mab21l, rx3, tbx2b, hmx4, myca, hmx1, tbx2a
47	14 hpf	2	12h-7	midbrain neural rod	eng2b, dmbx1a, sox21a, her3, pax7a, otx1b, ackr3a, otx2, pou3f3a, ackr3a
48	14 hpf	3	12h-1	optic vesicle (ventral)	foxd1, cyp27c1, rx1, rx2, rx3, vcana, six7, six3a
49	14 hpf	4	NA	mid/hind progenitors (neural plate)	her4.2, sox3, her8a, eng2b, her3
50	14 hpf	5	NA	dienc-midbrain boundary	fabp7a, otx2, pax6a, mab21l1, foxb1a, dmbx1a
51	14 hpf	6	12h-9	dorsal diencephalon	barhl1a, barhl2, olig3, pax6a, wnt8b, wnt4a, lhx5, olig2, otx1b, foxb1a
52	14 hpf	7	12h-8	hindbrain rhombomere 7	hoxa3a, hoxb1b, hoxb3a, hoxb5b, hoxd4a, crabp2a, rxrga
53	14 hpf	8	12h-4	neural crest	tfap2a, sox10, ednrab, pdgfra, sox9b, twist1b, prex2, fam212aa, zic2b, cxxc5b
54	14 hpf	9	NA	hindbrain (ant. dorsal, upper rhombic lip)	atoh1a, msx1b, casz1, zic2a, msx3, olig3, zic2b
55	14 hpf	10	12h-5	mid-hind boundary/ant hindbrain	eng2b, eng2a, eng1b, pax2a, pax8, fgf8a, gbx2, pax2b, pax7a, pax5
56	14 hpf	11	12h-23	optic stalk (ventral diencephalon)	vax1, fezf1, olig2, gsx2, sox1b, nkx2.2a, foxd1, six3a, fezf2, lhx5, nkx2.9
57	14 hpf	12	12h-13	telencephalon 	emx3, foxg1a, sox1b, fezf2, hesx1, lhx2b, dlx3b, rspo3, ntn1b, sp8b
58	14 hpf	13	12h-17	hindbrain rhombomere 1/2	cyp26b1, egfl6.1, hoxa2b, irx3a, ptgdsb.1, her3, pax7b, dbx1b
59	14 hpf	14	12h-2	midbrain	eng2b, eng2a, her5, her11, cxcl14, wnt8b, pax2a, pax7a, ackr3a, lmx1bb
60	14 hpf	15	12h-20	ventral diencephalon	dbx1a, sst1.2. nkx2.4a, nkx2.4b, shha, shhb, nkx2.1, fzd8b, nkx2.2b, lft1, rx3
61	14 hpf	16	12h-32	ventral midbrain	nkx6.2, helt, nkx2.9, ntn1a, nkx2.2b, foxa, foxa1, foxa2, nkx2.2a
62	14 hpf	17	12h-31	neurons	elavl3, vim, myt1a, dlb, tuba8l3, ebf2, neurod1, myt1b, neurod4, srrm4, celf3a, nova2, nfasca, draxin, scrt2, ebf3a
63	14 hpf	18	12h-11	hindbrain rhombomere 6	mafba, cyp26c1.1, crygmx, hoxa3a, hoxb3a, lbx1b, cryba1l1
64	14 hpf	19	12h-33	epidermis	cldni, pfn1, thy1, tagln2, spaca4l, cyp2k16, tbx2a, gata2a, hpgd
65	14 hpf	20	12h-27	hindbrain rhombomere 3	egr2b, cyp26b1, epha4a, hoxb2a, her4.2, her3, hoxa2b, zwi, gabra5, gbx1, myo1cb, pou3f1, pax7b, cspg5a
66	14 hpf	21	12h-14	heart primordium	tdgf1, hand2, ttn.2, gdf3, gata5, mef2ca, gata6, nkx2.5, tmem88a
67	14 hpf	23	12h-11	hindbrain rhombomere 5	hoxa2b, hoxa3a, hoxb3a, ackr3b, egr2b, mafba
68	14 hpf	24	12h-1	optic vesicle (dorsal)	foxg1a, rx1, rx3, six3b, aldh1a3, hmx4, lhx2b
69	14 hpf	25	12h-40	mesoderm (head mesenchyme)	ntd5, cxcl12b, col11a1a, lsp1, plpp1a, ripply1, tgfbi, fstl1a, pitx3, twist1a, nkx3-1, foxc1a, foxc1b, foxf2a
70	14 hpf	26	12h-16	mesoderm	thbs3b, meox1, prrx1a, cthrc1a, foxc1a, cxcl12b, reck, foxc1b, efb1a
71	14 hpf	27	12h-10	placode (lens)	tp63, pak2a, fermt1, pitx2, arl3l1, ptgs2a, pitx3, vgll4l, p2rx3a, dlx3b, krt97, epcam, snai2, tagln2, fmo5, pax6b, foxe3
72	14 hpf	28	12h-21	placode (epibranchial)	foxi1, myl10, six1b, eya1, cldn7b, pax8, f11r.1, gbx2
73	14 hpf	29	12h-18	telencephalon II	fgf17, zic4, cdh6, zic1, foxg1a, noto, dlx3b, rspo3, emx3, fgf8a, lmo1, lhx2b, hesx1, dlx4b
74	14 hpf	30	NA	somite (mesoderm)	msgn1, cdx4, apoc1, hes6, her7, tbx16, hoxb7a, ta, snai1a, hoxc3a, tbx6l, hox10a, vox, hoxd9a, vent
75	14 hpf	31	12h-36	rostral blood island (myeloid)	lmo2, etv2, tal1, sox7, dusp5, spi1b, cebpa, fli1a, cxcr4a
76	14 hpf	32	12h-33/34	epidermis	pfn1, apoeb, apoc1, cfl1l, tagln2, cldni, cdx4, thy1, myh9a, spaca4l, fermt1, nme2a
77	14 hpf	33	12h-15	prechordal plate/polster	ctslb, he1a, ctslb.1, fkbp11, he1b, pitx2, mcfd2
78	14 hpf	34	12h-29	placode (adenohypophyseal); neurons	sp8a, fezf1, fgf24, dlx4b, neurod1, insm1b, uncx, arl3l1, six1b, cdr2l, dlx3b, fgf17, emx3, hesx1, elavl3
79	14 hpf	35	12h-30	pharyngeal endoderm	cd9b, col2a1a, mcama, prdx5, myl10, epcam, f11r.1, pltp, irx7, nkx2.7, foxa, foxa1, foxa2, foxa3
80	14 hpf	36	12h-39	floor plate	aplnr2, foxa2, shha, shhb, lgals2a, foxj1a, daw1, lmx1bb
81	14 hpf	37	12h-35	adaxial cell	myl10, vwde, meox1, fn1bb, efemp2a, ttn.2, ttn.1, tnni2b.1, tgfbi, rbp7b, myod1, myog
82	14 hpf	38	12h-22	placode (otic)	cldna, stc2a, dlx3b, eya1, agr2, six1b, oc90, sox10, f11r.1, pax2a, foxj1a, gbx2
83	14 hpf	39	12h-45	epidermal ionocyte	foxi3a, foxi3b, ndrg3a, cldnh, gcm2, sstr5
84	14 hpf	40	12h-42	periderm	anxa1c, agr1, anxa1bb, icn2, ponzr5, uox, capn9
85	14 hpf	41	12h-41	neural crest (pre-mig/migratory)	ednrab, fam212aa, twist1b, plekhg5a, sox10, egr2b, foxd3, zwi, tfap2a, hnf1bb, mafba, egr2b
86	16 hpf	0	14h-1	optic vesicle (dorsal)	rx1, vsx2, rx2, hmx4, tbx2b, hmx1, pax6b
87	16 hpf	2	14h-28	placode (epibranchial)	foxi1, myl10, six1b, eya1, cldn7b, pax8, f11r.1, gbx2
88	16 hpf	3	14h-15	ventral diencephalon	nkx2.4b, nkx2.4a, sst1.2, nkx2.1, rx3, shha, nkx2.2b, fezf2, fzd8b, six6b, sox1b, olig2, nkx2.2a, nkx2.9, prdx1
89	16 hpf	4	14h-20	hindbrain (floor plate/boundary - r3)	cyp26b1, dbx1b, mpz, egfl6.1, dbx1a, sox21a, hoxa2b, cspg5a, foxb1a, gbx1
90	16 hpf	5	14h-6	dorsal diencephalon	lhx5, fezf2, olig2, pax6a, olig3, nr2e1, fezf1, stra6, gsx2, foxd1
91	16 hpf	6	14h-8/NA	neural crest	ednrab, dlx2a, sox10, twist1a, mef2ca, fam212aa, pmp22a, tfap2a, twist1b, pdgfra
92	16 hpf	7	14h-3	optic vesicle (ventral)	foxd1, cx43, rx1, rx2, vsx2, cyp27c1
93	16 hpf	8	14h-7	hindbrain (floor plate/boundary - r7)	crabp2a, hoxa3a, hoxd4a, wnt11r, cygb1, gfap, hoxb3a, hoxc3a
94	16 hpf	9	14h-2	midbrain neural rod	pax7a, ackr3a, eng2b, dmbx1a, mab21l2, otx2, wnt3, pou3f3a, eng2a, pax7b
95	16 hpf	10	14h-12	telencephalon	emx3, foxg1a, lmo1, npy, fezf2, rspo3, dlx3b, gsx2
96	16 hpf	11	14h-10	mid-hind boundary/ant hindbrain	eng1b, pax5, eng2a, eng2b, fgf8a, pax8, pax2a, gbx2
97	16 hpf	12	14h-11	optic stalk (ventral diencephalon)	vax1, sox1b, fezf1, six3b, pax2a, nrxn1a, six3a, nog2
98	16 hpf	13	14h-7	hindbrain rhombomere 7	hoxd4a, hoxc3a, wnt11r, bicd1a, olig3, raraa, hoxa3a, crap2a, tshz1, olig4, pax3a
99	16 hpf	14	NA	optic vesicle/optic stalk	aldh1a3, rx1, stra6, vax1, cyp27c1, six3b, pax6b, pax2a
100	16 hpf	15	14h-19	epidermis	pfn1, cldni, tagln2, thy1, myh9a, spaca4l, cotl1, ecrg4b, nkx2.7, nkx2.3,
101	16 hpf	16	14h-38	placode (otic)	cldna, oc90, agr2, sox10, otomp, bricd5
102	16 hpf	17	14h-16	ventral midbrain 	ntn1a, phox2bb, nkx2.9, nkx2.2b, foxa, nkx6.2, pou3f1, sulf2b, nkx2.2a, nkx6.1, ntn1b, foxa2, foxa1
103	16 hpf	18	14h-6	dorsal diencephalon II	barhl2, dbx1a, pax6a, tcf7l2, foxb1a, barhl1a, lmo3, rbp5, otx1b, fgfr3, helt, sox19a, id1.1, her3
104	16 hpf	19	14h-18	hindbrain rhombomere 6	cyp26c1.1, mafba, cryba1l1, cryba4, crygn2, lim2.1, hoxb3a, prdx6, cx23, hoxa3a, cscl12a, prox2, cryba2b
105	16 hpf	20	14h-9	hindbrain (ant. dorsal, upper rhombic lip)	zic2b, mdkb, casz1, pax3a, msx1b, zic1, fzd10, msx3, olig3, zic5
106	16 hpf	21	14h-35	pharyngeal endoderm	pltp, pax1a, pax1b, myl10, cxcl12b, fgfrl1b, foxa2, krt18, cd9b, mcama, cldnb, foxa1, foxi1, foxa
107	16 hpf	22	14h-26	mesoderm	angptl7, cthrc1a, colec12, reck, thbs3b, prrx1a, foxc1b, tbx15, foxc1a, twist1b, meox1
108	16 hpf	23	14h-13	hindbrain rhombomere 2	gsx1, lbx1b, phox2bb, egfl6.1, pax7b, pax3a, pax7a, cyp26b1, hoxa2b, her15.1, her4.1, her2
109	16 hpf	24	14h-17	neurons	gadd45gb.1, dlb, elavl3, her13, ebf2, srrm4, vim, neurod4, dla, draxin, neurog1, fstl1a
110	16 hpf	25	NA	cycling progenitors	id1.1, cdca7a, mcm5, mcm2, mcm3
111	16 hpf	26	14h-29	telencephalon II	plcxd3, zic4, lmo1, foxg1a, sox1b, zic1, gsx2, fezf2, noto, six3a, npy, emx3, she, fgf8a
112	16 hpf	27	14h-14	midbrain	eng2b, eng2a, her5, her11, cnpy1, pax5, ackr3a, wnt8b, eng1b, lmx1bb, pax8, pax2a, pax7a, otx2, otx1a, otx1b
113	16 hpf	28	14h-41	neural crest	ednrab, pmp22a, dlx2a, tfap2a, mafba, sox10, hoxa3a, atf3, twist1b, hoxb3a, crestin, hoxa2b
114	16 hpf	29	NA	neural crest (ectomesenchyme)	fam212aa (inka1a), ednrab, sdhda, twist1a, pdgfra, pmp22a, nrp2a, tuba8l3, foxc1a, tnc, tfap2a, sox10, fli1a
115	16 hpf	30	NA	lens differentiation	hmx4, foxe3, vcana, prox1a, hmx1, ampd3b, bmp5, etv1, sema3a, aplnra
116	16 hpf	31	14h-25	mesoderm (head mesenchyme)	tmem88a, fibina, ntd5, ndnfl, prrx1a, foxc1a, tcf21, pitx3, foxc1b, fmoda, tgfbi, foxf2a, foxd2
117	16 hpf	32	NA	epidermis	cldni, krt97, pfn1, cxcl14, pak2a, tfap2c, ptgs2a, sdpra, kera, dcn
118	16 hpf	33	14h-33	prechordal plate/polster	he1a, ctslb, he1b, fkbp11, cldnh, pitx2, fxyd1, cnpy1, klf17, mgp
119	16 hpf	34	14h-23	hindbrain rhombomere 5	egr2b, mafba, cryba2b, zic2b, hoxa3a, timp2b, olig3, msx3, sema3fb, hoxa2b, hoxb2a, hoxb3a, 
120	16 hpf	35	14h-9	hindbrain (ant. dorsal, upper rhombic lip)	msx1b, zic2b, atoh1a, msx3, olig3, bmp5, zic1
121	16 hpf	36	NA	pectoral fin field	cd151, aldh1a2, pcolcea, rbpms2b, tdgf1, gata5, kcnip1b, gdf3, oaz2b, jam2b, hand2
122	16 hpf	37	14h-21	heart primordium	tnnt2a, ttn.2, tnni1b, myl7, vmhc, smtnl1, cd151, gdf3, hand2, nkx2.5, myocd, gata5
123	16 hpf	38	14h-34	placode (adenohypophyseal)	fgf24, ptgs2a, sp8a, dlx5a, dlx4b, dlx3b, fezf1, six1b
124	16 hpf	39	14h-40	periderm	krt17, anxa1c, lye, icn2, agr1, anxa1b, eppk1, cst14b.1, s100a10b, cldne, capn9
125	16 hpf	40	14h-27	placode (lens)	arl3l1, pitx2, pitx3, fam69c, cldni, krt96, tp63, nme2a, col1a2, nid2a, ecrg4b,
126	16 hpf	41	14h-20	hindbrain rhombomere 3	egr2b, timp2b, sema3fb, hoxa2b, zic2b, msx1b
127	16 hpf	42	NA	blood precursors	blf, spi1b, mmp13a, cebpb, ikzf1, cebpa, fam212a, myb, ncf1
128	16 hpf	43	14h-23	hindbrain (floor plate/boundary - r5)	egr2b, mafba, crygn2, cryba2b, hoxa3a, mpz, hoxa2b, otpb
129	16 hpf	44	14h-31	rostral blood island (myeloid)	lmo2, etv2, dusp5, sox7, clec14a, tal1, she, fli1a
130	16 hpf	45	14h-8	neural crest	tfec, cax1, pax3a, slc1a3a, id2a, sox10, ednrab, fam212aa, slc15a2, prex2
131	16 hpf	46	14h-37	adaxial cell	actc1b, myl10, vwde, tnni2b.1, ttn.1, ttn.2, myog, meox1
132	16 hpf	47	14h-17	neurons	stmn1b, sncb, tmsb, mllt11, elavl4, gng3, gap43, stmn2a, stmn2b, snap25a, fez1, csdc2a
133	16 hpf	48	NA	placode (olfactory)	neurod1, neurod4, insm1b, uncx, lhx2a, gmnc, cldnh, ebf3a, sp8a, srrm4
134	16 hpf	49	14h-36	floor plate	lgals2a, shha, spon1b, col9a1b, col9a2, shhb, tbata, enkur, foxa2, foxj1a
135	16 hpf	50	NA	pharyngeal erythrocyte lineage	hbae3, pdx1, hbbe1.2, cldnc, hbbe1.1, aqp12, slc13a2, fgfrl1b, gata6, foxa2
136	16 hpf	51	14h-17	neurons (ganglion)	neurod1, scrt2, isl2b, tlx3b, prkg1a, neurod4, insm1, dlb, srrm4
137	16 hpf	52	14h-39	epidermal ionocyte	mat2al, foxi3a, foxi3b, atp1b1b, agrp, gcm2, dmrt2a, 
138	16 hpf	53	14h-31	rostral blood island (myeloid)	etv2, sox7, tal1, lmo2, grapa, esm1, snai1a, plk2b, fli1b
139	16 hpf	54	NA	notochord	loxl5b, col9a1b, ta, slc38a8b, col8a1a, sncga, vgll2b
140	18 hpf	0	16h-0	optic vesicle (dorsal)	rx1, vsx2, hmx4, tbx2b, hmx1, pax6b, rx2, foxg1b
141	18 hpf	2	16h-9	midbrain neural rod	eng2b, pax7a, mab21l2, pax7b, dmbx1a, ackr3a, pax3a, eng2a, otx2, otx1b
142	18 hpf	3	16h-7	optic vesicle (ventral)	foxd1, rx1, epha3, cx43, rx2, fcho2, vsx2
143	18 hpf	4	16h-27	midbrain	eng2b, eng2a, eng1b, pax2a, her5, pax5, pax8, her11, fgf8a
144	18 hpf	5	16h-4	hindbrain (floor plate/boundary - r3)	cyp26b1, hoxa2b, egfl6.1, dbx1b, mpz, dbx1a, gbx1, her3, foxb1a, egr2b
145	18 hpf	6	16h-3	ventral diencephalon	nkx2.4b, nkx2.4a, rx3, shha, sst1.2, nkx2.1, fezf2, prdx1, dbx1a
146	18 hpf	7	16h-20	hindbrain (ant. dorsal, rhombic lip)	casz1, mdkb, zic2b, pax3a, msx1b, msx3, zic1, zic2a, zic3, olig3, irx1b
147	18 hpf	8	16h-23	hindbrain rhombomere 2/3	gsx1, lbx1b, pax7b, hoxa2b, pax3a, phox2bb, egr2b, pax7a, mpz, hoxb2a
148	18 hpf	9	16h-13	hinbrain rhombomere 7	hoxd4a, hoxc3a, wnt11r, cygb1, hoxa3a, raraa, bicd1a, rxrga, olig3, olig4, hoxb3a, pax3a, msx3
149	18 hpf	10	NA	diencephalon	barhl2, rspo2, shox2, wnt4a, wnt8b, tcf7l2, barhl1a, rbp5, otx2, otx1b, otx1a
150	18 hpf	11	16h-24	comitted progenitors	gadd45gb.1, dlb, srrm4, ebf2, neurod4, her13, fstl1a, elavl3, vim, dld
151	18 hpf	12	NA	progenitors (cycling)	id1.1, sox3, her4.2, pou3f1, ntn1a, mcm4, sox19a, her4.1, gfap, mcm2
152	18 hpf	13	16h-10	telencephalon I	emx3, foxg1a, znf296, emx2, fezf1, fezf2, lmo1, lhx9, lhx2b, her15.1, her15.2
153	18 hpf	14	NA	dienc-midbrain boundary	dbx1a, dx1b, her3, id1.1, tcf7l2, helt, pou3f3b, mab21l2, irx1a, sox19a, dmbx1a
154	18 hpf	15	NA	pharyngeal arch (posterior)	hoxd4a, hoxb5b, hoxa3a, crabp2a, rxrga, hoxb3a, hoxb5a, wnt11r, hoxc3a, sp8a, hoxb1b, hoxc1a
155	18 hpf	16	16h-12	optic stalk (ventral diencephalon)	sox1b, vax1, eno4, fezf1, sox1b, pax2a, six6a, six3b
156	18 hpf	17	16h-35	hindbrain (ant. dorsal, rhombic lip)	atoh1a, atoh8, msx3, bmp5, olig3, cdh6, casz1, olig4, msx1b, zic2b, zic4
157	18 hpf	18	16h-26	telencephalon II	foxg1a, lmo1, plcxd3, npy, gsx2, sox1b, fezf2, zic4, zic1, emx3, she, nog2, noto, lhx2b
158	18 hpf	19	NA/16h-32	epidermis	cxcl14, krt97, tagln2, s100a10b, myh9a, lgals1l1, thy1, tfap2c, col28a2a, col4a3, col4a4, aqp3a, myof, dlx4a
159	18 hpf	20	16h-2	placode (epibranchial)	ripply3, vgll4l, tp63, apoeb, cfl1l, foxi1, epcam, six1b, pfn1, cldnb, cldni, nkx2.7
160	18 hpf	21	16h-17	ventral midbrain	foxa, foxa1, nkx6.2, nkx2.9, foxa2, nkx2.2b, phox2a, ntn1a, helt
161	18 hpf	22	16h-15	epidermis	cyp26a1, tagln2, myh9a, sdprb, wu:fj16a03, cyp2aa6, spaca4l, nkx2.7, nkx2.3, cldni, pfn1, nkx3.3
162	18 hpf	23	16h-6	neural crest	twist1b, ednrab, dlx2a, grem2b, mef2ca, cthrc1a, pmp22a, fam212aa, sox10
163	18 hpf	24	16h-19	hinbrain rhombomere 6	mafba, cryba1l1, cryba4, cryba2a, lim2.1, crybb1, cyp26c1.1, hoxb3a, crygn2, bfsp2, hoxa3a
164	18 hpf	25	16h-34	hinbrain rhombomere 5	egr2b, cryba2b, mafba, crygn2, hoxa3a, hoxb3a, mpz, ptn, lim2.1, hoxa2b
165	18 hpf	26	16h-5	dorsal diencephalon	lhx5, olig2, wnt7b, arxa, fezf2, fezf1, gsx2, pax6a, foxd1
166	18 hpf	27	16h-22	mesoderm	fxyd1, cthrc1a, angptl7, colec12, tgfbi, fibina, reck, prrx1a, foxc1b, thbs3b
167	18 hpf	28	NA	cycling progenitors	nusap1, kpna2, pax3a, mki67, top2a, cdk1, tpx2, plk1, pax7a
168	18 hpf	29	16h-30	lens differentiation	hmx4, prox1a, hmx1, foxe3, vcana, sox1a, rbm24a, pitx3
169	18 hpf	30	16h-36	pectoral fin field	cd151, cracr2b, ttn.2, hand2, gdf3, tdgf1, gata5, rbpms2b, pcolcea, nkx2.5, aldh1a2
170	18 hpf	31	16h-40	placode (lens)	pitx2, arl3l1, pitx3, krt96, cldni, tp63, six1b, fermt1, col1a2, fam69c, vgll4l
171	18 hpf	32	16h-17	ventral midbrain 	phox2bb, nkx2.2b, nkx2.9, sulf2b, nkx2.2a, nkx6.2, nkx6.1, foxa, hoxa3a, hoxd4a
172	18 hpf	33	16h-50	pharyngeal erythrocyte lineage	hbae3, cebpa, cldnc, hbbe1.1, hbbe1.2, fgfrl1b, sgk2a, foxa2, barx1, foxa3, hoxb1b, pltp
173	18 hpf	34	16h-47	neurons	elavl4, tmsb, mllt11, sncb, gng3, myt1b, ywhag2, gap43, cplx2l, sept5a, tubb2, stmn2b, draxin, nhlh2
174	18 hpf	35	16h-21	pharyngeal endoderm	pax1b, pax1a, pltp, s100t, capgb, fgfrl1b, myl10, fgf20b, nkx2.7, nkx2.3, foxj1a, fermt1, isl1, foxa2
175	18 hpf	36	16h-29	neural crest (ectomesenchyme)/NA	foxc1a, alx4a, fam212aa, alx1, twist1a, hic1, ednrab, twist3, tuba8l3, snai1a, sdhda, foxc1b, gbx2, fli1a, tnc
176	18 hpf	37	16h-49	floor plate	shha, col9a2, lgals2a, col9a1b, col9a3, spon1b, shhb, loxl5b, foxa1, foxj1a, daw1
177	18 hpf	38	16h-32	epidermis	cldni, cfl1l, pfn1, ppp1r1b, tfap2c, dcn, ecrg4b, capn8, kera, tfap2a
178	18 hpf	39	16h-15	epidermis	spaca4l, cfd, scinla, rbp4, mmp30, cyp2aa6, tagln2, 
179	18 hpf	40	16h-31	mesoderm (head mesenchyme)	pitx3, tmem88a, foxc1a, lpar1, foxc1b, prrx1a, foxl1, foxf2a, meox1, tbbx1.1
180	18 hpf	41	16h-38	placode (adenohypophyseal)	fgf24, sp8a, dlx4b, fam26f, pvalb8, dlx5a, eya2, dmrt3a, dlx3b, dlx6a, emx3, fgf17
181	18 hpf	42	16h-27	midbrain	her5, her11, eng2a, eng2b, wnt8b, eng1b, ackr3a, rspo2, pax5, pax8, otx2, otx1b, pax2a
182	18 hpf	43	16h-45	neural crest	tfec, sox10, trpm1b, cax1, slc3a2a, gch2, mon1ba, gpr143, crestin
183	18 hpf	44	16h-48	placode (olfactory)	neurod1, ebf3a, insm1b, dlx3b, elavl3, neurod4, cldnh, emx3, ebf2, tua8l3, dlx4b
184	18 hpf	45	16h-16	placode (otic)	stm, cldna, oc90, agr2, efhd1, bricd5, otomp, pax2a
185	18 hpf	46	NA	diencephalon	dbx1a, shha, barhl1b, pitx3, pcbd1, barhl2, nkx2.4a, pitx2, nkx2.4b, lmx1bb, foxa1, foxa2, lhx5, foxb1a, barhl1a
186	18 hpf	47	16h-39	periderm	krt5, krt92, krt17, cyt1l, krt4, agr1, anxa1c, lye, capn9, eppk1, icn2, ovol1
187	18 hpf	48	16h-28	neural crest	pmp22a, ednrab, dlx2a, twist1a, hoxa3a, hoxb3a, prdm1a, nr2f2, ndrg3a, crestin, sox10
188	18 hpf	49	16h-51	neurons (ganglion)	neurod1, isl2b, tlx3b, scrt2, isl1, insm1b, neurod4, vim, elavl3, tuba8l3, dlb, ebf3a
189	18 hpf	50	NA	telencephalon (pallium, neuron)	eomesa, tbr1b, emx1, scrt2, nrn1a, neurod4, myt1b, srrm4, celf3a, celf3b, emx3, lhx9, dlb, elavl3
190	18 hpf	51	16h-53	rostral blood island (myeloid)	lmo2, tal1, etv2, tmem88a, sox7, egfl7, aplnrb, fli1b, dusp5, yrk, vsg1
191	18 hpf	52	16h-37	heart primordium	cmlc1, myl7, tnnt2a, ttn.2, tnni1b, vmhc, acta1b, fhl2a, smtnl1, ttn.1, tnnc1a, nexn.1, unc45b
192	18 hpf	53	NA	RPE	pmela, dct, mitfa, tfec, wnt2, bhlhe40, trpm1b, cx43, slc45a2, elovl4b, gsx2
193	18 hpf	54	16h-44	rostral blood island (myeloid)	cldn5b, etv2, clec14a, dusp5, sox7, she, cdh5, gpr182, kdrl, yrk, plk2b, ecscr, tpd52l1, dll4
194	18 hpf	55	16h-33	prechordal plate/polster	he1a, ctsl, ctsl.1, he1b
195	18 hpf	56	16h-42	blood precursors	blf, spi1b, cebpb, mmp13a, fn1a, txn, ncf1, ikzf1
196	18 hpf	57	16h-39	periderm	krt5, krt92, krt17, anxa1c, krt4, uox, tgm1l4, anxa3a, gna14, stx11b.1, dnah11, ftr86, s100v1, dbnla, cav2
197	18 hpf	58	NA	somite	vwde, rbp7b, angptl7, COMP, thbs4b, kazald2, fn1b, rprmb, meox1, tcf15, hoxa2b, hoxa3a, hoxb3a, hoxb5a
198	18 hpf	59	16h-52	epidermal ionocyte	foxi3a, atp1b1b, agrp, ca15a, foxi3b, gcm2, dmrt2a, sstr5, grhl1, mal2, ca2
199	20 hpf	0	18h-3	optic vesicle (ventral)	rx1, vsx2, six3b, pax6b, foxd1, nop10
200	20 hpf	1	18h-13/18/26	telencephalon	fezf1, sox1b, fezf2, foxg1a, gsx2, emx3, auts2b, lrig1, her2, six3b, cyp26c1.1, nr2e1, six3a, olig2, lhx5, lhx2b
201	20 hpf	2	NA	progenitors	her4.2.1, rrm2.1, her4.2, her2, her15.2, pcna, lig1, stmn1a, mcm5, mcm4
202	20 hpf	3	NA	progenitors	gfap, sox3, pcna, cdc6, her8a, mcm2, mcm3, mcm5
203	20 hpf	4	NA	progenitors	sox21a, foxb1a, gfap, aurka, dbx1b, setd8b, pif1, sox19a, top2a, mki67, dbx1a, her3
204	20 hpf	5	NA	progenitors (eye)	fabp7a, stmn1a, pcna, rrm2.1, chchd10
205	20 hpf	6	NA	progenitors (midbrain)	eng2b, pcna, fzd10, nop58, gfap, pax7a, eng2a
206	20 hpf	7	18h-6	ventral diencephalon	rx3, nkx2.4b, nkx2.4a, nkx2.1, sfrp5, shha, sst1.2, sox1b, nkx2.2b, fezf2, prdx1, olig2, nkx2.2a, six3a
207	20 hpf	8	NA	neurons, gabaergic, glutamatergic	sncb, ywhag2, elavl4, atp6v0cb, gap43, stmn2a, snap25a, scg2b, stx1b, stmn2b, id4, eno2, celf4, gad1b, gad2
208	20 hpf	9	NA	pectoral fin	ifitm1, rgs5a, hpdb, hgd, ttc36, fmoda, col6a1, prrx1b, ms4a17a.9, bhmt, lhx6, mxra8b, pmp22a, aspn, twist3, cald1b
209	20 hpf	10	18h-19	epidermis	cldni, cfl1l, pfn1, krt97, kera, ecrg4b, s100a10b, myh9a, tnw, spaca4l, col28a2a, tp63, ptgs2a, tfap2c
210	20 hpf	11	18h-11	comitted progenitors	gadd45gb.1, dld, dla, lrnn1, neurog1, her4.2, ebf2, dlb, her15.2, neurod4, ascl1a
211	20 hpf	12	NA	eye (cornea), cartilage	matn4, col2a1a, col9a3, lect1, col9a1a, col9a2, fmoda, fstl3, cthrc1a, epyc, wfdc2, col5a1, fibina, bhmt, tnmd
212	20 hpf	13	18h-15	pharyngeal arch (posterior)	hoxa3a, hoxb1b, hoxb3a, hoxb5a, hoxb5b, hoxb6a, hoxb6b, hoxb8a, hoxc1a, hoxc3a, hoxd4a, wnt11r, 
213	20 hpf	14	18h-23	neural crest	ednrab, dlx2a, grem2b, twist1a, mef2ca, sox10, tuba8l3, pmp22a, pdgfr, fam212aa, fli1a
214	20 hpf	15	18h-36/NA	neural crest (ectomesenchyme)	foxc1a, twist1a, colec12, tmem88b, six1a, npb, pmp22a, tnc, nid1b, cxcl12b, fibina, mfap2
215	20 hpf	16	18h-21	ventral midbrain	foxa, foxa2, nkx2.2b, foxa1, shha, nkx2.9, nkx6.2, nkx2.2a, phox2bb, barhl1a, nkx6.1
216	20 hpf	17	18h-20	placode (epibranchial)	cxcl12b, krt18, krt8, myl10, cd9b, epcam, cldnb, six1b, cldn7b, nid2a, foxi1, f11r.1, nkx2.7, irx7, cxcl12b
217	20 hpf	18	18h-NA	radial glia	glula, fabp7a, cx43, slc1a2b, ptgdsb.2, atp14, mt2, atp1a1b, mfge8a, ptgdsb.1, s100b, ndrg3a
218	20 hpf	19	18h-27	mesoderm	cthrc1a, rbp7b, thbs3b, angptl7, colec12, col11a1b, tmem100b, meox1, fmoda, fibina, twist1a, reck, pmp22a, tgfbi, vwde
219	20 hpf	20	18h-NA	progenitors (midbrain)	fzd10, nusap1, cdc20, tpx2, zic4, mki67, top2a, kpn2, plk1, aurka, zic2a, zic1, zic2b, eng2b, eng2a, zic3
220	20 hpf	21	18h-34	neurons	dlb, elavl3, neurod4, ebf2, myt1b, insm1a, onecut1, nhlh2, gadd45gb.1, myt1a, scrt2, srrm4, ebf3a, draxin, insm1b
221	20 hpf	22	18h-38	epidermis	cldn1, fermt1, ecrg4b, myh9a, tp63, fam49ba, padi2, mapk12a, nkx2.3, aplnra, vgll4l, cfl1l, cldni, pfn1, s10010b
222	20 hpf	23	18h-34/NA	neurons, gabaergic, glutamatergic	atp1a3a, atp1b1b, atp2b3a, snap25a, aldocb, ywhag2, cplx2l, stmn2a, sncb, gap43, scg2b, cox8b, stxbp1a, eef1a1a, gad1b
223	20 hpf	24	NA	pectoral fin	aspn, wfdc2, mxra8b, cldn11a, serpinf1, pdgfrl, ctgfb, hyal4, gsc, loxa, spon2b, fmoda, twist2, ogn, col1a2, pmp22a
